index:ID,name,code,:LABEL
804257,中信建投山西国有企业债定开债券C,005528,Fund
804258,银华华茂定期开放债券,005529,Fund
804259,汇添富价值多因子量化策略股票,005530,Fund
804260,华安安悦债券A,005531,Fund
804261,华安安悦债券C,005532,Fund
804262,银华国企改革混合发起式,005533,Fund
804263,华夏新时代灵活配置混合(QDII),005534,Fund
804264,泰信竞争优选混合,005535,Fund
804265,中航新起航灵活配置混合A,005537,Fund
804266,中航新起航灵活配置混合C,005538,Fund
804267,前海开源盛鑫混合A,005541,Fund
804268,前海开源盛鑫混合C,005542,Fund
804269,银华心诚灵活配置混合,005543,Fund
804270,银华瑞和灵活配置混合,005544,Fund
804271,中银改革红利灵活配置混合,005545,Fund
804272,诺安圆鼎定期开放债券,005547,Fund
804273,诺安鑫享定期开放债券,005548,Fund
804274,富国成长优选三年定开混合,005549,Fund
804275,汇安成长优选混合A,005550,Fund
804276,汇安成长优选混合C,005551,Fund
804277,国富新趋势混合A,005552,Fund
804278,国富新趋势混合C,005553,Fund
804279,南方H股联接A,005554,Fund
804280,南方H股联接C,005555,Fund
804281,汇安裕华纯债定期开放,005556,Fund
804282,广发海外多元配置(QDII)人民币,005557,Fund
804283,广发海外多元配置(QDII)美元,005558,Fund
804284,广发集泰债券A,005559,Fund
804285,广发集泰债券C,005560,Fund
804286,创金合信中证红利低波动指数A,005561,Fund
804287,创金合信中证红利低波动指数C,005562,Fund
804288,创金合信国证1000指数A,005563,Fund
804289,创金合信国证1000指数C,005564,Fund
804290,创金合信国证2000指数A,005565,Fund
804291,创金合信国证2000指数C,005566,Fund
804292,创金合信MSCI中国A股国际指数A,005567,Fund
804293,创金合信MSCI中国A股国际指数C,005568,Fund
804294,中融智选红利股票A,005569,Fund
804295,中融智选红利股票C,005570,Fund
804296,中银证券新能源混合A,005571,Fund
804297,中银证券新能源混合C,005572,Fund
804298,东吴悦秀纯债A,005573,Fund
804299,东吴悦秀纯债C,005574,Fund
804300,长信稳鑫三个月定期开放债券,005575,Fund
804301,华泰柏瑞新金融地产混合,005576,Fund
804302,交银施罗德丰晟收益债券A,005577,Fund
804303,交银施罗德丰晟收益债券C,005578,Fund
804304,光大保德信晟利债券A,005579,Fund
804305,光大保德信晟利债券C,005580,Fund
804306,华夏3-5年中高级可质押信用债ETF联接A,005581,Fund
804307,华夏3-5年中高级可质押信用债ETF联接C,005582,Fund
804308,易方达港股通红利混合,005583,Fund
804309,银河文体娱乐混合,005585,Fund
804310,安信比较优势混合,005587,Fund
804311,长安裕腾混合A,005588,Fund
804312,长信企业精选两年定期开放灵活混合,005589,Fund
804313,添富鑫永定开债A,005590,Fund
804314,添富鑫永定开债C,005591,Fund
804315,长安裕腾混合C,005592,Fund
804316,上投摩根创新商业模式灵活配置混合,005593,Fund
804317,招商添润3个月定开债发起式A,005594,Fund
804318,招商添润3个月定开债发起式C,005595,Fund
804319,建信战略精选灵活配置混合A,005596,Fund
804320,建信战略精选灵活配置混合C,005597,Fund
804321,广发中小盘精选混合,005598,Fund
804322,汇安量化优选混合A,005599,Fund
804323,汇安量化优选混合C,005600,Fund
804324,嘉实新添康定期混合A,005603,Fund
804325,嘉实新添康定期混合C,005604,Fund
804326,招商招鸿6个月定期开放债券,005606,Fund
804327,华宝中证500增强A,005607,Fund
804328,华宝中证500增强C,005608,Fund
804329,富国军工主题混合,005609,Fund
804330,中银泰享定期开放债券,005610,Fund
804331,中银证券汇享定期开放债,005611,Fund
804332,嘉实核心优势股票,005612,Fund
804333,富时发达市场REITs,005613,Fund
804334,富时发达市场REITs美钞,005614,Fund
804335,富时发达市场REITs美汇,005615,Fund
804336,东方量化成长灵活配置混合,005616,Fund
804337,中信保诚嘉鑫定期开放债券型发起式,005617,Fund
804338,融通红利机会主题精选灵活配置混合A,005618,Fund
804339,融通红利机会主题精选灵活配置混合C,005619,Fund
804340,中欧品质消费股票A,005620,Fund
804341,中欧品质消费股票C,005621,Fund
804342,博时富安3个月定开债发起式,005622,Fund
804343,广发中债1-3年农发债指数A,005623,Fund
804344,广发中债1-3年农发债指数C,005624,Fund
804345,南华瑞鑫定期开放债券,005625,Fund
804346,汇安趋势动力股票A,005628,Fund
804347,汇安趋势动力股票C,005629,Fund
804348,华安研究精选混合,005630,Fund
804349,博时富乾3个月定开债发起式,005631,Fund
804350,鹏华量化先锋混合,005632,Fund
804351,建信中证500指数增强C,005633,Fund
804352,汇安行业龙头混合,005634,Fund
804353,博时量化多策略股票A,005635,Fund
804354,博时量化多策略股票C,005636,Fund
804355,中融聚业定期开放债券,005637,Fund
804356,农银汇理量化智慧动力混合,005638,Fund
804357,平安300ETF联接A,005639,Fund
804358,平安300ETF联接C,005640,Fund
804359,国投瑞银顺源债券,005641,Fund
804360,鹏扬景升混合A,005642,Fund
804361,鹏扬景升混合C,005643,Fund
804362,广发沪港深龙头混合,005644,Fund
804363,华泰保兴尊信定开,005645,Fund
804364,中海沪港深多策略灵活配置混合,005646,Fund
804365,广发汇佳定期开放债券,005647,Fund
804366,招商添琪3个月定开债发起式A,005648,Fund
804367,招商添琪3个月定开债发起式C,005649,Fund
804368,万家量化同顺多策略A,005650,Fund
804369,万家量化同顺多策略C,005651,Fund
804370,国富天颐混合A,005652,Fund
804371,国富天颐混合C,005653,Fund
804372,天弘悦享定期开放债券,005654,Fund
804373,诺安浙享定期开放债券,005655,Fund
804374,光大保德信安泽债券A,005656,Fund
804375,光大保德信安泽债券C,005657,Fund
804376,华夏沪深300ETF联接C,005658,Fund
804377,南方恒生交易型开放式指数联接C,005659,Fund
804378,嘉实资源精选股票A,005660,Fund
804379,嘉实资源精选股票C,005661,Fund
804380,嘉实金融精选股票A,005662,Fund
804381,嘉实金融精选股票C,005663,Fund
804382,鹏扬景欣混合A,005664,Fund
804383,鹏扬景欣混合C,005665,Fund
804384,上银慧佳盈债券,005666,Fund
804385,易方达富财纯债债券,005667,Fund
804386,融通新能源汽车,005668,Fund
804387,前海开源公用事业行业股票,005669,Fund
804388,嘉实致兴定期纯债债券,005670,Fund
804389,新疆前海联合研究优选混合A,005671,Fund
804390,新疆前海联合研究优选混合C,005672,Fund
804391,诺德消费升级,005674,Fund
804392,易方达恒生国企联接(QDII)C,005675,Fund
804393,易方达标普消费品(人民币)QDIIC,005676,Fund
804394,安信永盛定开债券,005677,Fund
804395,安信尊享添益债券A,005678,Fund
804396,财通资管鑫盛6个月定期开放混合,005679,Fund
804397,财通资管价值成长混合,005680,Fund
804398,财通资管消费精选混合,005682,Fund
804399,国寿安保华兴灵活配置混合,005683,Fund
804400,财通资管鸿睿12个月定期开放债券A,005684,Fund
804401,财通资管鸿睿12个月定期开放债券C,005685,Fund
804402,财通资管瑞享12个月定期开放混合,005686,Fund
804403,中银医疗保健灵活配置混合,005689,Fund
804404,中银安享债券,005690,Fund
804405,南方中证100指数C,005691,Fund
804406,广发全指工业ETF联接C,005692,Fund
804407,广发中证军工ETF联接C,005693,Fund
804408,华富恒玖3个月定期开放债券A,005694,Fund
804409,华安睿明两年定开混合A,005695,Fund
804410,华安睿明两年定开混合C,005696,Fund
804411,华夏全球科技先锋混合(QDII),005698,Fund
804412,工银新经济混合人民币,005699,Fund
804413,工银新经济混合美元,005700,Fund
804414,上投摩根香港精选港股通混合,005701,Fund
804415,恒生前海港股通高股息低波动指数,005702,Fund
804416,永赢增益债券A,005703,Fund
804417,永赢增益债券C,005704,Fund
804418,永赢恒益债券,005705,Fund
804419,兴业龙腾双益平衡混合,005706,Fund
804420,富国港股通量化精选股票型,005707,Fund
804421,国联安远见成长混合,005708,Fund
804422,华安鼎益债券A,005709,Fund
804423,兴业嘉润3个月定开债券发起式,005710,Fund
804424,永赢惠添利灵活配置混合,005711,Fund
804425,兴全祥泰定期开放债券,005712,Fund
804426,中融季季红定期开放债券A,005713,Fund
804427,中融季季红定期开放债券C,005714,Fund
804428,人保纯债一年定开A,005715,Fund
804429,人保纯债一年定开C,005716,Fund
804430,兴业机遇债券,005717,Fund
804431,招商招诚半年定开债发起式,005719,Fund
804432,前海开源乾盛定期开放债券A,005720,Fund
804433,前海开源乾盛定期开放债券C,005721,Fund
804434,前海联合泓瑞定开债券,005722,Fund
804435,中融聚安定期开放债券,005723,Fund
804436,交银致远智投混合,005724,Fund
804437,国投瑞银恒泽中短债债券A,005725,Fund
804438,国泰价值精选灵活配置混合,005726,Fund
804439,嘉实中创400联接C,005727,Fund
804440,华宝绿色主题混合,005728,Fund
804441,南方人工智能主题混合,005729,Fund
804442,国泰江源优势精选灵活配置混合,005730,Fund
804443,财通资管睿智6个月定期开放债券,005731,Fund
804444,富国臻选成长灵活配置混合,005732,Fund
804445,华夏上证50ETF联接C,005733,Fund
804446,华夏沪港通恒生ETF联接C,005734,Fund
804447,华夏MSCI中国A股国际通ETF联接C,005735,Fund
804448,中欧兴华定期开放债券,005736,Fund
804449,博时上证50ETF联接C,005737,Fund
804450,长城智能产业混合,005738,Fund
804451,富国转型机遇混合,005739,Fund
804452,易方达恒信定期开放债券发起式,005740,Fund
804453,南方君信混合,005741,Fund
804454,南方成安优选混合,005742,Fund
804455,长安裕隆灵活配置A,005743,Fund
804456,长安裕隆灵活配置C,005744,Fund
804457,广发汇康定期开放债券,005745,Fund
804458,国泰聚利价值定期开放灵活配置混合,005746,Fund
804459,华安MSCI中国A股国际A,005747,Fund
804460,华安MSCI中国A股国际C,005748,Fund
804461,银河庭芳3个月定期开放债券,005749,Fund
804462,平安双债添益债券A,005750,Fund
804463,平安双债添益债券C,005751,Fund
804464,金鹰添盛定开债券,005752,Fund
804465,泰达宏利金利债券,005753,Fund
804466,平安短债A,005754,Fund
804467,平安短债C,005755,Fund
804468,平安短债E,005756,Fund
804469,长江汇聚量化多因子,005757,Fund
804470,中融量化精选FOF(A),005758,Fund
804471,中融量化精选FOF(C),005759,Fund
804472,富国周期优势混合,005760,Fund
804473,招商MSCI中国A股国际通指数A,005761,Fund
804474,招商MSCI中国A股国际通指数C,005762,Fund
804475,中欧电子信息产业沪港深股票C,005763,Fund
804476,中欧潜力价值灵活配置混合C,005764,Fund
804477,中欧明睿新常态混合C,005765,Fund
804478,平安合瑞定开债,005766,Fund
804479,南方共享经济混合,005769,Fund
804480,信达澳银中证沪港深高股息精选,005770,Fund
804481,银华可转债债券,005771,Fund
804482,工银瑞景定开发起式债券,005772,Fund
804483,华夏产业升级混合,005774,Fund
804484,中加转型动力混合A,005775,Fund
804485,中加转型动力混合C,005776,Fund
804486,广发科技动力股票,005777,Fund
804487,广发汇元纯债定期开放债券,005778,Fund
804488,鑫元常利定期开放债券,005779,Fund
804489,鑫元增利定期开放,005780,Fund
804490,华富富瑞3个月定期开放债券,005781,Fund
804491,创金合信汇益纯债一年定开债券A,005782,Fund
804492,创金合信汇益纯债一年定开债券C,005783,Fund
804493,创金合信汇誉纯债六个月定开债券A,005784,Fund
804494,创金合信汇誉纯债六个月定开债券C,005785,Fund
804495,中邮纯债汇利三个月定期开放债券,005786,Fund
804496,中欧新趋势混合C,005787,Fund
804497,MSCI中国A股国际通交易A,005788,Fund
804498,MSCI中国A股国际通交易C,005789,Fund
804499,银河景行3个月定开债券,005790,Fund
804500,华夏鼎福三个月定期开放债券A,005791,Fund
804501,华夏鼎福三个月定期开放债券C,005792,Fund
804502,华富可转债债券,005793,Fund
804503,银华心怡灵活配置混合,005794,Fund
804504,博时中证500指数增强C,005795,Fund
804505,嘉实新添荣定期混合A,005796,Fund
804506,嘉实新添荣定期混合C,005797,Fund
804507,创金合信春来回报一年期定期开放A,005799,Fund
804508,创金合信春来回报一年期定期开放C,005800,Fund
804509,工银印度基金美元,005801,Fund
804510,添富智能制造股票,005802,Fund
804511,广发中证京津冀ETF联接A,005803,Fund
804512,广发中证京津冀ETF联接C,005804,Fund
804513,华泰柏瑞医疗健康混合,005805,Fund
804514,华泰柏瑞国企整合,005806,Fund
804515,安信中证复兴发展100主题指数A,005807,Fund
804516,安信中证复兴发展100主题指数C,005808,Fund
804517,前海开源裕源,005809,Fund
804518,南方瑞祥一年混合A,005810,Fund
804519,南方瑞祥一年混合C,005811,Fund
804520,鹏华产业精选,005812,Fund
804521,华安CES港股通精选100ETF联接A,005813,Fund
804522,华安CES港股通精选100ETF联接C,005814,Fund
804523,农银汇理睿选混合,005815,Fund
804524,国泰农惠定期开放债券,005816,Fund
804525,金元顺安沣顺定开债发起式,005817,Fund
804526,金元顺安沣泰定开债发起式,005818,Fund
804527,国泰优势行业混合,005819,Fund
804528,博时富兴纯债3个月定开债发起式,005820,Fund
804529,万家新机遇龙头企业混合,005821,Fund
804530,国富恒裕6个月定期开放债券,005822,Fund
804531,泰康颐享混合A,005823,Fund
804532,泰康颐享混合C,005824,Fund
804533,申万菱信智能驱动股票,005825,Fund
804534,华夏潜龙精选股票,005826,Fund
804535,易方达蓝筹精选混合,005827,Fund
804536,长江乐越定期开放债券,005828,Fund
804537,建信MSCI联接A,005829,Fund
804538,建信MSCI联接C,005830,Fund
804539,鹏华尊悦发起式定开债券,005831,Fund
804540,景顺长城MSCIETF联接,005832,Fund
804541,工银瑞信红利优享灵活配置混合A,005833,Fund
804542,工银瑞信红利优享灵活配置混合C,005834,Fund
804543,招商稳祯定期开放混合,005835,Fund
804544,富国产业驱动混合,005840,Fund
804545,富国尊利纯债定期开放债券型发起式,005841,Fund
804546,海富通弘丰定期开放债券,005842,Fund
804547,金元顺安沣泉债券,005843,Fund
804548,东方人工智能主题混合,005844,Fund
804549,长城久荣纯债定开债券,005845,Fund
804550,宝盈盈泰纯债债券A,005846,Fund
804551,富国沪港深业绩驱动混合,005847,Fund
804552,银华裕利混合发起式,005848,Fund
804553,鑫元合利定期开放债券,005849,Fund
804554,财通量化价值优选混合,005850,Fund
804555,财通新视野混合A,005851,Fund
804556,中银添利债券C,005852,Fund
804557,财通聚利纯债债券,005853,Fund
804558,财通汇利纯债债券,005854,Fund
804559,中科沃土沃瑞灵活配置混合A,005855,Fund
804560,中科沃土沃瑞灵活配置混合C,005856,Fund
804561,添富鑫成定开债A,005857,Fund
804562,添富鑫成定开债C,005858,Fund
804563,南方固胜定期开放混合,005859,Fund
804564,华夏鼎禄三个月定开债券A,005862,Fund
804565,华夏鼎禄三个月定开债券C,005863,Fund
804566,国投瑞银顺达纯债债券,005864,Fund
804567,浦银安盛量化多策略混合A,005865,Fund
804568,浦银安盛量化多策略混合C,005866,Fund
804569,国泰沪深300指数C,005867,Fund
804570,平安MSCI中国A股国际ETF联接A,005868,Fund
804571,平安MSCI中国A股国际ETF联接C,005869,Fund
804572,鹏华沪深300指数,005870,Fund
804573,天弘荣享定开债券,005871,Fund
804574,太平恒利纯债债券,005872,Fund
804575,建信创业板ETF联接A,005873,Fund
804576,建信创业板ETF联接C,005874,Fund
804577,易方达中盘成长混合,005875,Fund
804578,易方达鑫转增利混合A,005876,Fund
804579,易方达鑫转增利混合C,005877,Fund
804580,博时产业新动力灵活配置混合C,005878,Fund
804581,中加颐兴定开债券,005879,Fund
804582,建信上证50ETF联接A,005880,Fund
804583,建信上证50ETF联接C,005881,Fund
804584,财通资管鸿达纯债债券E,005882,Fund
804585,华宝港股通香港精选混合,005883,Fund
804586,平安合悦定期开放债券,005884,Fund
804587,金鹰信息产业股票C,005885,Fund
804588,华夏鼎沛债券A,005886,Fund
804589,华夏鼎沛债券C,005887,Fund
804590,华夏新兴消费混合A,005888,Fund
804591,华夏新兴消费混合C,005889,Fund
804592,先锋博盈纯债A,005890,Fund
804593,先锋博盈纯债C,005891,Fund
804594,先锋汇盈纯债债券A,005892,Fund
804595,先锋汇盈纯债债券C,005893,Fund
804596,华夏优势精选股票,005894,Fund
804597,平安合丰定期开放纯债债券,005895,Fund
804598,平安合慧定开债,005896,Fund
804599,平安合颖定开债,005897,Fund
804600,浦银安盛盛泽定期开放债券,005898,Fund
804601,国投瑞银品牌优势混合,005899,Fund
804602,国投瑞银行业先锋混合,005900,Fund
804603,诺安汇利混合A,005901,Fund
804604,诺安汇利混合C,005902,Fund
804605,泰达宏利绩优增长灵活配置混合,005903,Fund
804606,华泰保兴成长优选混合A,005904,Fund
804607,华泰保兴成长优选混合C,005905,Fund
804608,招商丰茂灵活混合发起式A,005906,Fund
804609,招商丰茂灵活混合发起式C,005907,Fund
804610,华泰保兴尊利债券A,005908,Fund
804611,华泰保兴尊利债券C,005909,Fund
804612,广发龙头优选灵活配置混合,005910,Fund
804613,广发双擎升级混合,005911,Fund
804614,广发全球收益债券A人民币(QDII),005912,Fund
804615,广发全球收益债券C人民币(QDII),005913,Fund
804616,景顺长城智能生活混合,005914,Fund
804617,广发汇誉3个月定期开放债券,005917,Fund
804618,天弘沪深300指数C,005918,Fund
804619,天弘中证500指数C,005919,Fund
804620,富国颐利纯债债券,005920,Fund
804621,农银汇理金鑫3个月定期开放债券,005921,Fund
804622,圆信永丰,005922,Fund
804623,建信福泽裕泰混合(FOF)A,005925,Fund
804624,建信福泽裕泰混合(FOF)C,005926,Fund
804625,创金合信新能源汽车主题股票A,005927,Fund
804626,创金合信新能源汽车主题股票C,005928,Fund
804627,中融恒裕纯债A,005931,Fund
804628,中融恒裕纯债C,005932,Fund
804629,前海联合先进制造混合A,005933,Fund
804630,前海联合先进制造混合C,005934,Fund
804631,前海联合润丰混合C,005935,Fund
804632,申万菱信安泰惠利纯债债券A,005936,Fund
804633,工银精选金融地产混合A,005937,Fund
804634,工银精选金融地产混合C,005938,Fund
804635,工银瑞信新能源汽车主题混合A,005939,Fund
804636,工银瑞信新能源汽车主题混合C,005940,Fund
804637,工银瑞信聚福混合A,005943,Fund
804638,工银瑞信聚福混合C,005944,Fund
804639,工银可转债优选债券A,005945,Fund
804640,工银可转债优选债券C,005946,Fund
804641,德邦民裕进取量化精选灵活配置混合A,005947,Fund
804642,德邦民裕进取量化精选灵活配置混合C,005948,Fund
804643,鑫元行业轮动混合A,005949,Fund
804644,鑫元行业轮动混合C,005950,Fund
804645,民生加银恒益纯债债券A,005951,Fund
804646,民生加银恒益纯债债券C,005952,Fund
804647,人保转型混合A,005953,Fund
804648,人保转型混合C,005954,Fund
804649,易方达鑫转添利混合A,005955,Fund
804650,易方达鑫转添利混合C,005956,Fund
804651,华夏聚丰稳健目标风险混合A(FOF),005957,Fund
804652,华夏聚丰稳健目标风险混合C(FOF),005958,Fund
804653,财通新视野混合C,005959,Fund
804654,博时量化价值股票A,005960,Fund
804655,博时量化价值股票C,005961,Fund
804656,宝盈人工智能股票A,005962,Fund
804657,宝盈人工智能股票C,005963,Fund
804658,中欧安财定期开放债券,005964,Fund
804659,安信中证500指数增强A,005965,Fund
804660,安信中证500指数增强C,005966,Fund
804661,鹏华创新驱动混合,005967,Fund
804662,创金合信工业周期股票A,005968,Fund
804663,创金合信工业周期股票C,005969,Fund
804664,国泰消费优选股票,005970,Fund
804665,平安惠锦债券,005971,Fund
804666,交银裕如纯债债券A,005972,Fund
804667,交银裕如纯债债券C,005973,Fund
804668,东方红配置精选混合A,005974,Fund
804669,东方红配置精选混合C,005975,Fund
804670,长信稳进资产配置混合(FOF),005976,Fund
804671,中信保诚至兴混合A,005977,Fund
804672,中信保诚至兴混合C,005978,Fund
804673,南方合顺多资产A,005979,Fund
804674,南方合顺多资产C,005980,Fund
804675,上投摩根核心精选股票,005983,Fund
804676,兴业纯债一年定开债券A,005988,Fund
804677,兴业纯债一年定开债券C,005989,Fund
804678,申万菱信安泰惠利纯债债券C,005990,Fund
804679,光大保德信超短债债券A,005992,Fund
804680,光大保德信超短债债券C,005993,Fund
804681,国投瑞银中证500指数量化增强A,005994,Fund
804682,国投瑞银顺泓定开债券,005995,Fund
804683,国投瑞银纯债,005996,Fund
804684,天弘裕利灵活配置混合C,005997,Fund
804685,嘉实深证基本面120ETF联接C,005998,Fund
804686,嘉实中证金融地产ETF联接C,005999,Fund
804687,工银瑞信医药健康行业股票A,006002,Fund
804688,工银瑞信医药健康行业股票C,006003,Fund
804689,工银瑞信添祥一年定开债券,006004,Fund
804690,诺安鼎利混合A,006005,Fund
804691,诺安鼎利混合C,006006,Fund
804692,诺安积极配置混合A,006007,Fund
804693,诺安积极配置混合C,006008,Fund
804694,国融融银混合A,006009,Fund
804695,国融融银混合C,006010,Fund
804696,中信保诚稳鸿债券A,006011,Fund
804697,中信保诚稳鸿债券C,006012,Fund
804698,易方达鑫转招利混合A,006013,Fund
804699,易方达鑫转招利混合C,006014,Fund
804700,华安信用四季红债券C,006015,Fund
804701,平安惠安纯债债券,006016,Fund
804702,广发景智纯债债券,006019,Fund
804703,广发沪深300指数增强A,006020,Fund
804704,广发沪深300指数增强C,006021,Fund
804705,富国大盘价值量化精选混合,006022,Fund
804706,诺安优化配置混合,006025,Fund
804707,东吴鼎泰纯债债券,006026,Fund
804708,国投瑞银顺祥定期开放债券,006027,Fund
804709,鹏华尊享定期开放发起式债券,006029,Fund
804710,南方昌元转债A,006030,Fund
804711,南方昌元转债C,006031,Fund
804712,富国MSCI中国A股国际通指数增强,006034,Fund
804713,中融恒惠纯债A,006035,Fund
804714,中融恒惠纯债C,006036,Fund
804715,国泰瑞和纯债债券,006037,Fund
804716,大成景恒混合C,006038,Fund
804717,富兰克林国海估值优势混合,006039,Fund
804718,安信永瑞定开债券,006040,Fund
804719,上投摩根尚睿混合(FOF),006042,Fund
804720,永赢惠益债券A,006043,Fund
804721,永赢惠益债券C,006044,Fund
804722,长信稳健纯债债券E,006047,Fund
804723,长城中证500指数增强A,006048,Fund
804724,恒越研究精选混合A,006049,Fund
804725,恒越研究精选混合B,006050,Fund
804726,鹏扬核心价值混合A,006051,Fund
804727,鹏扬核心价值混合C,006052,Fund
804728,中航瑞景3个月定开债券A,006053,Fund
804729,中航瑞景3个月定开债券C,006054,Fund
804730,鹏扬淳合债券,006055,Fund
804731,鹏华丰和债券C类(LOF),006057,Fund
804732,民生加银新兴成长混合,006058,Fund
804733,鹏扬泓利债券A,006059,Fund
804734,鹏扬泓利债券C,006060,Fund
804735,红土创新增强收益债券A,006061,Fund
804736,景顺长城MSCI中国A股国际通,006063,Fund
804737,红土创新增强收益债券C,006064,Fund
804738,景顺长城景泰稳利定期开放债券C,006065,Fund
804739,中加颐睿纯债债券A,006066,Fund
804740,中加颐睿纯债债券C,006067,Fund
804741,中加颐信纯债债券A,006068,Fund
804742,中加颐信纯债债券C,006069,Fund
804743,银河沃丰纯债债券,006070,Fund
804744,银河睿嘉纯债债券A,006071,Fund
804745,民生加银创新成长混合,006072,Fund
804746,人保鑫瑞中短债债券A,006073,Fund
804747,人保鑫瑞中短债债券C,006074,Fund
804748,博时标普500ETF联接C,006075,Fund
804749,创金合信恒利超短债债券A,006076,Fund
804750,创金合信恒利超短债债券C,006077,Fund
804751,海富通电子信息传媒产业股票C,006080,Fund
804752,海富通电子信息传媒产业股票A,006081,Fund
804753,鑫元全利债券A,006082,Fund
804754,鑫元全利债券C,006083,Fund
804755,融通研究优选混合,006084,Fund
804756,万家新机遇价值驱动灵活配置混合C,006085,Fund
804757,银河睿丰定期开放债券,006086,Fund
804758,华泰柏瑞中证500ETF联接C,006087,Fund
804759,永赢润益债券A,006088,Fund
804760,永赢润益债券C,006089,Fund
804761,前海开源鼎康债券A,006090,Fund
804762,前海开源鼎康债券C,006091,Fund
804763,永赢荣益债券A,006092,Fund
804764,永赢荣益债券C,006093,Fund
804765,永赢泰益债券A,006094,Fund
804766,永赢泰益债券C,006095,Fund
804767,中金浙金6个月定期开放债券,006096,Fund
804768,平安高等级债,006097,Fund
804769,华宝券商ETF联接A,006098,Fund
804770,泰达宏利泽利3个月定开债券,006099,Fund
804771,平安优势产业混合A,006100,Fund
804772,平安优势产业混合C,006101,Fund
804773,浙商丰利增强债券,006102,Fund
804774,凯石淳行业精选混合A,006103,Fund
