index:ID,name,code,:LABEL
800001,华夏成长混合,000001,Fund
800002,中海可转债债券A,000003,Fund
800003,中海可转债债券C,000004,Fund
800004,嘉实增强信用定期债券,000005,Fund
800005,西部利得量化成长混合,000006,Fund
800006,嘉实中证500ETF联接基金A,000008,Fund
800007,易方达天天理财货币A,000009,Fund
800008,易方达天天理财货币B,000010,Fund
800009,华夏大盘精选混合,000011,Fund
800010,易方达天天理财货币R,000013,Fund
800011,华夏聚利债券,000014,Fund
800012,华夏纯债债券A,000015,Fund
800013,华夏纯债债券C,000016,Fund
800014,财通可持续混合,000017,Fund
800015,景顺长城品质投资混合,000020,Fund
800016,华夏优势增长混合,000021,Fund
800017,大摩双利增强债券A,000024,Fund
800018,大摩双利增强债券C,000025,Fund
800019,华富安鑫债券,000028,Fund
800020,富国宏观策略灵活配置混合,000029,Fund
800021,长城核心优选混合,000030,Fund
800022,华夏复兴混合,000031,Fund
800023,易方达信用债债券A,000032,Fund
800024,易方达信用债债券C,000033,Fund
800025,广发理财7天债券A,000037,Fund
800026,广发理财7天债券B,000038,Fund
800027,农银高增长混合,000039,Fund
800028,华夏全球股票(QDII),000041,Fund
800029,中证财通可持续发展100指数A,000042,Fund
800030,嘉实美国成长股票(QDII)人民币,000043,Fund
800031,嘉实美国成长股票(QDII)美元现汇,000044,Fund
800032,工银产业债券A,000045,Fund
800033,工银产业债券B,000046,Fund
800034,华夏双债债券A,000047,Fund
800035,华夏双债债券C,000048,Fund
800036,中银标普全球资源等权重(QDII),000049,Fund
800037,华夏沪深300ETF联接A,000051,Fund
800038,鹏华永诚一年定期开放债券,000053,Fund
800039,鹏华双债增利债券,000054,Fund
800040,广发纳斯达克100指数A(美元现汇),000055,Fund
800041,建信消费升级混合,000056,Fund
800042,中银消费主题混合,000057,Fund
800043,国联安灵活配置混合,000058,Fund
800044,国联安中证医药100A,000059,Fund
800045,华夏盛世精选混合,000061,Fund
800046,长盛电子信息主题灵活配置混合,000063,Fund
800047,大摩18个月定期开放债券,000064,Fund
800048,国富焦点驱动混合,000065,Fund
800049,诺安鸿鑫保本混合,000066,Fund
800050,诺安鸿鑫股票,000066,Fund
800051,民生加银转债优选债券A,000067,Fund
800052,民生加银转债优选债券C,000068,Fund
800053,国投瑞银中高等级债券A,000069,Fund
800054,国投瑞银中高等级债券C,000070,Fund
800055,华夏恒生ETF联接A,000071,Fund
800056,华安保本混合,000072,Fund
800057,上投摩根成长动力混合,000073,Fund
800058,工银信用纯债一年定开债券A,000074,Fund
800059,华夏恒生ETF联接A(美元汇),000075,Fund
800060,华夏恒生ETF联接A(美元钞),000076,Fund
800061,工银信用纯债一年定开债券C,000077,Fund
800062,工银信用纯债两年定开债券A,000078,Fund
800063,工银信用纯债两年定开债券C,000079,Fund
800064,天治可转债增强债券A,000080,Fund
800065,天治可转债增强债券C,000081,Fund
800066,嘉实研究阿尔法股票,000082,Fund
800067,汇添富消费行业混合,000083,Fund
800068,博时安盈债券A,000084,Fund
800069,博时安盈债券C,000085,Fund
800070,南方稳利1年定期开放债券A,000086,Fund
800071,嘉实中证金边中期国债ETF联接A,000087,Fund
800072,嘉实中证金边中期国债ETF联接C,000088,Fund
800073,民生加银家盈理财月度A,000089,Fund
800074,民生加银家盈理财月度B,000090,Fund
800075,信诚新双盈分级债券,000091,Fund
800076,信诚新双盈分级债券A,000092,Fund
800077,信诚新双盈分级债券B,000093,Fund
800078,国泰中国企业境外高收益债券QDII,000103,Fund
800079,华宸未来稳健添利债券A,000104,Fund
800080,建信安心回报债券A,000105,Fund
800081,建信安心回报债券C,000106,Fund
800082,富国稳健增强债券A/B,000107,Fund
800083,富国稳健增强债券C,000109,Fund
800084,金鹰元安混合A,000110,Fund
800085,易方达纯债1年定期开放债券A,000111,Fund
800086,易方达纯债1年定期开放债券C,000112,Fund
800087,嘉实如意宝定期债券A/B,000113,Fund
800088,嘉实如意宝定期债券C,000115,Fund
800089,嘉实丰益纯债定期债券,000116,Fund
800090,广发轮动配置混合,000117,Fund
800091,广发聚鑫债券A,000118,Fund
800092,广发聚鑫债券C,000119,Fund
800093,中银美丽中国混合,000120,Fund
800094,华夏永福混合A,000121,Fund
800095,汇添富实业债债券A,000122,Fund
800096,汇添富实业债债券C,000123,Fund
800097,华宝服务优选混合,000124,Fund
800098,招商安润灵活配置混合,000126,Fund
800099,农银行业领先混合,000127,Fund
800100,大成景安短融债券A,000128,Fund
800101,大成景安短融债券B,000129,Fund
800102,大成景兴信用债债券A,000130,Fund
800103,大成景兴信用债债券C,000131,Fund
800104,理财28日盈A,000134,Fund
800105,理财28日盈B,000135,Fund
800106,民生加银策略精选混合,000136,Fund
800107,民生加银岁岁增利债券A,000137,Fund
800108,民生加银岁岁增利债券C,000138,Fund
800109,富国国有企业债债券A/B,000139,Fund
800110,富国国有企业债债券C,000141,Fund
800111,融通通泰保本A,000142,Fund
800112,鹏华双债加利债券,000143,Fund
800113,易方达高等级信用债A,000147,Fund
800114,易方达高等级信用债C,000148,Fund
800115,华安双债添利债券A,000149,Fund
800116,华安双债添利债券C,000150,Fund
800117,大成景旭纯债债券A,000152,Fund
800118,大成景旭纯债债券C,000153,Fund
800119,国投瑞银策略精选混合,000165,Fund
800120,中海信息产业精选混合,000166,Fund
800121,广发聚优灵活配置混合A,000167,Fund
800122,易方达裕丰回报,000171,Fund
800123,华泰柏瑞量化增强混合,000172,Fund
800124,汇添富美丽30混合,000173,Fund
800125,汇添富高息债债券A,000174,Fund
800126,汇添富高息债债券C,000175,Fund
800127,嘉实沪深300指数研究增强,000176,Fund
800128,广发美国房地产(QDII)(人民币),000179,Fund
800129,广发美国房地产(QDII)(美元),000180,Fund
800130,景顺长城四季金利债券A,000181,Fund
800131,景顺长城四季金利债券C,000182,Fund
800132,嘉实丰益策略定期债券,000183,Fund
800133,工银添福债券A,000184,Fund
800134,工银添福债券B,000185,Fund
800135,华泰柏瑞季季红债券,000186,Fund
800136,华泰柏瑞丰盛纯债A,000187,Fund
800137,华泰柏瑞丰盛纯债C,000188,Fund
800138,易方达丰华债券A,000189,Fund
800139,中银新回报灵活配置混合,000190,Fund
800140,富国信用债债券A/B,000191,Fund
800141,富国信用债债券C,000192,Fund
800142,银华信用四季红债券A,000194,Fund
800143,工银保本3号混合A,000195,Fund
800144,工银保本3号混合B,000196,Fund
800145,富国目标收益一年期纯债债券,000197,Fund
800146,天弘余额宝货币,000198,Fund
800147,国泰量化策略收益混合,000199,Fund
800148,博时岁岁增利一年定期开放债券,000200,Fund
800149,诺安泰鑫一年定期开放债A,000201,Fund
800150,富国目标收益两年期纯债债券,000202,Fund
800151,国富日日收益货币A,000203,Fund
800152,国富日日收益货币B,000204,Fund
800153,易方达投资级信用债债券A,000205,Fund
800154,易方达投资级信用债债券C,000206,Fund
800155,建信双债增强A,000207,Fund
800156,建信双债增强C,000208,Fund
800157,信诚新兴产业混合,000209,Fund
800158,光大保德信现金宝货币A,000210,Fund
800159,光大保德信现金宝货币B,000211,Fund
800160,泰信鑫益定期开放A,000212,Fund
800161,泰信鑫益定期开放C,000213,Fund
800162,广发成长优选混合,000214,Fund
800163,广发趋势优选灵活配置混合,000215,Fund
800164,华安黄金易ETF联接A,000216,Fund
800165,华安黄金易ETF联接C,000217,Fund
800166,国泰黄金ETF联接A,000218,Fund
800167,博时裕益混合,000219,Fund
800168,富国医疗保健行业混合,000220,Fund
800169,汇添富年年利定期开放债券A,000221,Fund
800170,汇添富年年利定期开放债券C,000222,Fund
800171,长盛年年收益定期债券A,000225,Fund
800172,长盛年年收益定期债券C,000226,Fund
800173,华安年年红债券A,000227,Fund
800174,诺安稳固收益一年定期开放债券,000235,Fund
800175,工银月月薪定期支付债券A,000236,Fund
800176,国投瑞银一年定期开放债A,000237,Fund
800177,国投瑞银一年定期开放债C,000238,Fund
800178,华安年年盈定期开放债券A,000239,Fund
800179,华安年年盈定期开放债券C,000240,Fund
800180,宝盈核心优势混合C,000241,Fund
800181,景顺长城策略精选灵活配置混合,000242,Fund
800182,天弘稳利定期开放A,000244,Fund
800183,天弘稳利定期开放B,000245,Fund
800184,博时月月薪定期支付债券,000246,Fund
800185,汇添富中证主要消费ETF联接,000248,Fund
800186,工银金融地产混合,000251,Fund
800187,景顺景兴纯债A,000252,Fund
800188,景顺景兴纯债C,000253,Fund
800189,长城定期开放债券A,000254,Fund
800190,长城定期开放债券C,000255,Fund
800191,上投摩根红利回报混合A,000256,Fund
800192,农银区间收益混合,000259,Fund
800193,工银信息产业混合,000263,Fund
800194,博时内需增长混合,000264,Fund
800195,易方达恒久添利1年定期开放债券A,000265,Fund
800196,易方达恒久添利1年定期开放债券C,000266,Fund
800197,广发集利一年定期开放债券A,000267,Fund
800198,广发集利一年定期开放债券C,000268,Fund
800199,嘉实合润双债两年期定期债券,000269,Fund
800200,建信安心保本混合,000270,Fund
800201,中邮定期开放A,000271,Fund
800202,中邮定期开放C,000272,Fund
800203,华润元大安鑫灵活配置混合,000273,Fund
800204,广发亚太债(QDII-人民币),000274,Fund
800205,广发亚太债(QDII-美元),000275,Fund
800206,博时双月薪定期支付债券,000277,Fund
800207,华商红利优选灵活配置,000279,Fund
800208,银华信用季季红债券A,000286,Fund
800209,鹏华丰泰定期开放债券A,000289,Fund
800210,鹏华全球高收益债(QDII),000290,Fund
800211,华安生态优先混合,000294,Fund
800212,鹏华丰实定期开放债券A,000295,Fund
800213,鹏华丰实定期开放债券B,000296,Fund
800214,鹏华可转债债券,000297,Fund
800215,中海纯债A,000298,Fund
800216,中海纯债C,000299,Fund
800217,德邦德利货币A,000300,Fund
800218,德邦德利货币B,000301,Fund
800219,中银中高等级债券A,000305,Fund
800220,天弘弘利债券,000306,Fund
800221,易方达黄金ETF联接A,000307,Fund
800222,建信创新中国混合,000308,Fund
800223,大摩品质生活股票,000309,Fund
800224,安信永利信用A,000310,Fund
800225,景顺长城沪深300指数,000311,Fund
800226,华安沪深300增强A,000312,Fund
800227,华安沪深300增强C,000313,Fund
800228,招商瑞丰灵活配置混合A,000314,Fund
800229,中海惠利纯债,000316,Fund
800230,中海惠利A,000317,Fund
800231,中海惠利B,000318,Fund
800232,泰达宏利淘利债券型A,000319,Fund
800233,泰达宏利淘利债券型C,000320,Fund
800234,农银汇理14天A,000322,Fund
800235,农银汇理14天B,000323,Fund
800236,华润元大现金收益货币A,000324,Fund
800237,华润元大现金收益货币B,000325,Fund
800238,南方中小盘成长股票,000326,Fund
800239,南方潜力新蓝筹混合,000327,Fund
800240,上投摩根转型动力灵活配置,000328,Fund
800241,鹏华丰饶定期开放债券,000329,Fund
800242,汇添富现金宝货币,000330,Fund
800243,中加货币A,000331,Fund
800244,中加货币C,000332,Fund
800245,长城稳固收益债券A,000333,Fund
800246,长城稳固收益债券C,000334,Fund
800247,安信永利信用C,000335,Fund
800248,农银汇理研究精选灵活配置,000336,Fund
800249,鹏华双债保利债券,000338,Fund
800250,长城医疗保健混合,000339,Fund
800251,嘉实新兴市场债券C2,000341,Fund
800252,嘉实新兴市场债券A1,000342,Fund
800253,华夏财富宝A,000343,Fund
800254,鹏华丰融定期开放债券,000345,Fund
800255,建信安心回报6个月定期开放债券A,000346,Fund
800256,建信安心回报6个月定期开放债券C,000347,Fund
800257,国富恒丰定期债券A,000351,Fund
800258,国富恒丰定期债券C,000352,Fund
800259,华夏现金增利E,000353,Fund
800260,长盛城镇化主题混合,000354,Fund
800261,南方丰元A,000355,Fund
800262,南方丰元C,000356,Fund
800263,易方达易理财,000359,Fund
800264,信诚年年有余A,000360,Fund
800265,信诚年年有余B,000361,Fund
800266,国泰聚信价值优势灵活配置混合A,000362,Fund
800267,国泰聚信价值优势灵活配置混合C,000363,Fund
800268,汇添富添富通货币A,000366,Fund
800269,国泰安康定期支付混合A,000367,Fund
800270,汇添富沪深300安中指数,000368,Fund
800271,广发全球医疗保健(QDII)(人民币),000369,Fund
800272,广发全球医疗保健(QDII)(美元),000370,Fund
800273,民生加银现金宝货币A,000371,Fund
800274,中银惠利半年定期开放债券,000372,Fund
800275,华安中证细分医药交易A,000373,Fund
800276,华安中证细分医药交易C,000376,Fund
800277,上投摩根双债增利A,000377,Fund
800278,上投摩根双债增利C,000378,Fund
800279,平安日增利货币,000379,Fund
800280,景顺长城景益货币A,000380,Fund
800281,景顺长城景益货币B,000381,Fund
800282,景顺长城景颐双利A,000385,Fund
800283,景顺长城景颐双利C,000386,Fund
800284,广发天天红货币A,000389,Fund
800285,华商优势行业灵活配置,000390,Fund
800286,融通通源短融债券A,000394,Fund
800287,汇添富安心中国债券A,000395,Fund
800288,汇添富安心中国债券C,000396,Fund
800289,汇添富全额宝货币,000397,Fund
800290,华富灵活配置混合,000398,Fund
800291,中融增鑫定期开放债券A,000400,Fund
800292,中融增鑫定期开放债券C,000401,Fund
800293,工银纯债债券A,000402,Fund
800294,工银纯债债券B,000403,Fund
800295,易方达新兴成长,000404,Fund
800296,汇添富双利增强债券A,000406,Fund
800297,汇添富双利增强债券C,000407,Fund
800298,民生加银灵活配置混合,000408,Fund
800299,鹏华环保产业股票,000409,Fund
800300,益民服务领先混合,000410,Fund
800301,景顺长城优质成长,000411,Fund
800302,嘉实绝对收益策略定期混合,000414,Fund
800303,大摩纯债稳定添利18个月定期A,000415,Fund
800304,大摩纯债稳定添利18个月定期C,000416,Fund
800305,国联安新精选灵活配置,000417,Fund
800306,景顺长城成长之星,000418,Fund
800307,大摩优质信价纯债A,000419,Fund
800308,大摩优质信价纯债C,000420,Fund
800309,华泰柏瑞丰汇债券A,000421,Fund
800310,华泰柏瑞丰汇债券C,000422,Fund
800311,前海开源事件驱动混合A,000423,Fund
800312,长盛添利宝货币A,000424,Fund
800313,长盛添利宝货币B,000425,Fund
800314,易方达聚盈分级,000428,Fund
800315,易方达聚盈A,000429,Fund
800316,易方达聚盈B,000430,Fund
800317,鹏华品牌传承混合,000431,Fund
800318,中银优秀企业混合,000432,Fund
800319,安信鑫发优选混合,000433,Fund
800320,新华壹诺宝货币A,000434,Fund
800321,建信稳定添利债券A,000435,Fund
800322,易方达裕惠回报定期开放式混合,000436,Fund
800323,融通月月添利定期开放债券A,000437,Fund
800324,融通月月添利定期开放债券B,000438,Fund
800325,国金鑫盈货币,000439,Fund
800326,南方医保,000452,Fund
800327,上投摩根核心成长,000457,Fund
800328,英大领先回报,000458,Fund
800329,农银汇理主题轮动灵活配置混合,000462,Fund
800330,华商双债丰利债券A,000463,Fund
800331,嘉实活期宝货币,000464,Fund
800332,景顺长城鑫月薪定期支付,000465,Fund
800333,融通通瑞债券A/B,000466,Fund
800334,富国目标齐利一年期纯债债券,000469,Fund
800335,富国城镇发展股票,000471,Fund
800336,广发天天利货币A,000475,Fund
800337,广发天天利货币B,000476,Fund
800338,广发主题领先混合,000477,Fund
800339,建信中证500指数增强A,000478,Fund
800340,东方红新动力混合,000480,Fund
800341,华商双债丰利债券C,000481,Fund
800342,鑫元货币A,000483,Fund
800343,鑫元货币B,000484,Fund
800344,嘉实1个月理财债券A,000485,Fund
800345,嘉实1个月理财债券E,000486,Fund
800346,嘉实3个月理财债券A,000487,Fund
800347,嘉实3个月理财债券E,000488,Fund
800348,光大保德信岁末红利纯债A,000489,Fund
800349,光大保德信岁末红利纯债C,000490,Fund
800350,南方现金通货币A,000493,Fund
800351,南方现金通货币B,000494,Fund
800352,南方现金通货币C,000495,Fund
800353,长安产业精选混合A,000496,Fund
800354,财通纯债债券A,000497,Fund
800355,华富恒富18个月定期开放债券C,000501,Fund
800356,华富恒富18个月定期开放债券A,000502,Fund
800357,中信建投景和中短债债券A,000503,Fund
800358,中信建投景和中短债债券C,000504,Fund
800359,国寿安保货币A,000505,Fund
800360,国寿安保货币B,000506,Fund
800361,泰达宏利宏达混合A,000507,Fund
800362,泰达宏利宏达混合B,000508,Fund
800363,广发钱袋子A,000509,Fund
800364,诺安永鑫收益一年定期开放,000510,Fund
800365,国泰国策驱动灵活配置混合A,000511,Fund
800366,国泰沪深300指数增强A,000512,Fund
800367,富国高端制造行业股票,000513,Fund
800368,富国祥利一年期定期开放债券A,000516,Fund
800369,富国祥利一年期定期开放债券C,000517,Fund
800370,上银新兴价值成长混合,000520,Fund
800371,诺安瑞鑫定期开放债券,000521,Fund
800372,华润元大信息传媒科技混合,000522,Fund
800373,国投瑞银医疗保健混合,000523,Fund
800374,上投摩根民生需求,000524,Fund
800375,国泰浓益灵活配置混合A,000526,Fund
800376,南方新优享A,000527,Fund
800377,工银薪金货币A,000528,Fund
800378,广发竞争优势混合,000529,Fund
800379,招商丰盛稳定增长混合A,000530,Fund
800380,东吴阿尔法灵活配置混合,000531,Fund
800381,景顺长城优势企业,000532,Fund
800382,永赢货币,000533,Fund
800383,长盛高端装备混合,000534,Fund
800384,长盛航天海工灵活配置混合,000535,Fund
800385,前海开源可转债债券,000536,Fund
800386,诺安优势行业灵活配置混合型A,000538,Fund
800387,中银活期宝货币,000539,Fund
800388,国金金腾通货币A,000540,Fund
800389,华商创新成长灵活配置混合型发起,000541,Fund
800390,上银慧财宝货币A,000542,Fund
800391,上银慧财宝货币B,000543,Fund
800392,中邮核心竞争力灵活配置混合,000545,Fund
800393,兴业定期开放债券A,000546,Fund
800394,建信健康民生混合,000547,Fund
800395,鹏华聚财通货币,000548,Fund
800396,华安大国新经济股票,000549,Fund
800397,广发新动力混合,000550,Fund
800398,信诚幸福消费混合,000551,Fund
800399,中加纯债一年A,000552,Fund
800400,中加纯债一年C,000553,Fund
800401,中国梦基金,000554,Fund
800402,国投瑞银新机遇混合A,000556,Fund
800403,国投瑞银新机遇混合C,000557,Fund
800404,诺安天天宝A,000559,Fund
800405,诺安天天宝E,000560,Fund
800406,南方启元债券A,000561,Fund
800407,南方启元债券C,000562,Fund
800408,南方通利A,000563,Fund
800409,南方通利C,000564,Fund
800410,华泰柏瑞创新升级混合,000566,Fund
800411,广发聚祥灵活混合,000567,Fund
800412,鹏华增值宝货币,000569,Fund
800413,中银多策略混合,000572,Fund
800414,天弘通利混合,000573,Fund
800415,宝盈新价值混合,000574,Fund
800416,兴全添利宝货币,000575,Fund
800417,中邮货币A,000576,Fund
800418,安信价值精选股票,000577,Fund
800419,鑫元恒鑫收益增强债券A,000578,Fund
800420,鑫元恒鑫收益增强债券C,000579,Fund
800421,中邮货币B,000580,Fund
800422,嘉实活钱包货币A,000581,Fund
800423,江信聚福,000583,Fund
800424,新华鑫益灵活配置混合,000584,Fund
800425,嘉实对冲套利定期混合,000585,Fund
800426,景顺长城中小板,000586,Fund
800427,大成灵活配置混合,000587,Fund
800428,招商招钱宝货币A,000588,Fund
800429,光大保德信银发商机主题混合,000589,Fund
800430,华安新活力混合,000590,Fund
800431,中银健康生活混合,000591,Fund
800432,建信改革红利股票,000592,Fund
800433,易方达标普消费品(美元现汇)QDIIA,000593,Fund
800434,大摩进取优选股票,000594,Fund
800435,嘉实泰和混合,000595,Fund
800436,前海开源中证军工指数A,000596,Fund
800437,中海积极收益灵活配置混合,000597,Fund
800438,长盛生态环境主题灵活配置混合,000598,Fund
800439,信诚薪金宝货币,000599,Fund
800440,汇添富和聚宝货币,000600,Fund
800441,华宝创新优选混合,000601,Fund
800442,富国安益货币,000602,Fund
800443,易方达创新驱动灵活配置混合,000603,Fund
800444,银华多利宝货币A,000604,Fund
800445,银华多利宝货币B,000605,Fund
800446,天弘优选债券,000606,Fund
800447,招商招钱宝货币B,000607,Fund
800448,华商新量化灵活配置混合,000609,Fund
800449,华宝生态中国混合,000612,Fund
800450,国寿安保沪深300ETF联接,000613,Fund
800451,华安德国龙头(DAX)ETF联接(QDII),000614,Fund
800452,长城工资宝货币A,000615,Fund
800453,上投摩根优信A,000616,Fund
800454,上投摩根优信C,000617,Fund
800455,嘉实薪金宝货币,000618,Fund
800456,东方红产业升级混合,000619,Fund
800457,易方达现金增利货币A,000620,Fund
800458,易方达现金增利货币B,000621,Fund
800459,华富恒财定期开放债券C,000623,Fund
800460,华富恒财定期开放债券A,000624,Fund
800461,诺安天天宝B,000625,Fund
800462,大成丰财宝货币A,000626,Fund
800463,大成丰财宝货币B,000627,Fund
800464,大成高新技术产业股票型,000628,Fund
800465,中银聚利半年定期开放债券,000632,Fund
800466,富国天盛灵活配置混合,000634,Fund
800467,富国富钱包货币,000638,Fund
800468,宝盈祥瑞混合,000639,Fund
800469,诺安理财宝货币A,000640,Fund
800470,诺安理财宝货币B,000641,Fund
800471,汇添富货币C,000642,Fund
800472,招商招金宝货币A,000644,Fund
800473,华夏薪金宝货币,000645,Fund
800474,华润元大医疗保健量化混合,000646,Fund
800475,易方达财富快线货币A,000647,Fund
800476,易方达财富快线货币B,000648,Fund
800477,长城久鑫灵活配置混合,000649,Fund
800478,汇添富货币D,000650,Fund
800479,招商招金宝货币B,000651,Fund
800480,博时裕隆灵活配置混合,000652,Fund
800481,华商新锐产业灵活配置混合,000654,Fund
800482,鑫元稳利债,000655,Fund
800483,前海开源沪深300指数,000656,Fund
800484,银华活钱宝货币A,000657,Fund
800485,银华活钱宝货币B,000658,Fund
800486,银华活钱宝货币C,000659,Fund
800487,银华活钱宝货币D,000660,Fund
800488,银华活钱宝货币E,000661,Fund
800489,银华活钱宝货币F,000662,Fund
800490,国投瑞银美丽中国混合,000663,Fund
800491,国联安通盈灵活配置混合A,000664,Fund
800492,博时现金收益货币B,000665,Fund
800493,工银绝对收益混合发起A,000667,Fund
800494,国寿安保尊享债券A,000668,Fund
800495,国寿安保尊享债券C,000669,Fund
800496,工银绝对收益混合发起B,000672,Fund
800497,中海惠祥分级债券,000674,Fund
800498,中海惠祥分级债券A,000675,Fund
800499,中海惠祥分级债券B,000676,Fund
800500,工银瑞信现金快线货币,000677,Fund
800501,华宝现金宝货币E,000678,Fund
800502,招商丰利灵活配置混合A,000679,Fund
800503,信达澳银慧管家货币A,000681,Fund
800504,信达澳银慧管家货币C,000682,Fund
800505,信达澳银慧管家货币E,000683,Fund
800506,长盛养老健康产业灵活配置混合,000684,Fund
800507,建信嘉薪宝货币A,000686,Fund
800508,南方薪金宝货币,000687,Fund
800509,景顺长城研究精选股票型,000688,Fund
800510,前海开源新经济混合,000689,Fund
800511,前海开源大海洋混合,000690,Fund
800512,汇添富双利C,000692,Fund
800513,建信现金添利货币A,000693,Fund
800514,鑫元鸿利债券,000694,Fund
800515,大成景益平稳收益混合,000695,Fund
800516,汇添富环保行业股票型,000696,Fund
800517,汇添富移动互联股票,000697,Fund
800518,宝盈科技30混合,000698,Fund
800519,中银薪钱包货币,000699,Fund
800520,泰达宏利货币B,000700,Fund
800521,景顺长城景丰货币A,000701,Fund
800522,易方达天天增利货币A,000704,Fund
800523,易方达天天增利货币B,000705,Fund
800524,中邮多策略灵活配置混合,000706,Fund
800525,景顺长城景丰货币B,000707,Fund
800526,华安安享灵活配置混合,000708,Fund
800527,华安汇财通货币,000709,Fund
800528,交银施罗德现金宝货币A,000710,Fund
800529,嘉实医疗保健股票,000711,Fund
800530,上投摩根天添宝货币A,000712,Fund
800531,上投摩根天添宝货币B,000713,Fund
800532,诺安稳健回报灵活配置混合A,000714,Fund
800533,民生加银家盈理财月度E,000715,Fund
800534,工银薪金货币B,000716,Fund
800535,融通转型三动力灵活配置混合,000717,Fund
800536,南方现金通货币E,000719,Fund
800537,南方稳利1年定期开放债券C,000720,Fund
800538,兴业货币市场A,000721,Fund
800539,兴业货币市场B,000722,Fund
800540,建信稳定添利债券C,000723,Fund
800541,大成添利宝货币A,000724,Fund
800542,大成添利宝货币B,000725,Fund
800543,大成添利宝货币E,000726,Fund
800544,融通健康产业灵活配置混合,000727,Fund
800545,工银瑞信目标收益一年定期开放C,000728,Fund
800546,建信中小盘先锋股票,000729,Fund
